{
  "$schema": "https://json-schema.org/draft/2020-12/schema",
  "type": "object",
  "additionalProperties": false,
  "required": ["schema_version", "conclusion", "accountable", "reason", "evidence_checks", "limitations"],
  "properties": {
    "schema_version": {"type": "integer", "const": 1},
    "conclusion": {"type": "string", "enum": ["locally_supported", "locally_rejected", "non_accountable"]},
    "accountable": {"type": "boolean"},
    "reason": {"type": "string", "minLength": 1},
    "evidence_checks": {
      "type": "array",
      "minItems": 1,
      "items": {
        "type": "object",
        "additionalProperties": false,
        "required": ["check", "status", "evidence"],
        "properties": {
          "check": {"type": "string", "minLength": 1},
          "status": {"type": "string", "enum": ["passed", "failed", "missing"]},
          "evidence": {"type": "string", "minLength": 1}
        }
      }
    },
    "limitations": {"type": "array", "items": {"type": "string", "minLength": 1}}
  }
}
